{
  "doc": {
    "id": "despliegue-estrategico-2026",
    "type": "okr-board",
    "title": "Despliegue Estratégico 2026",
    "version": 64,
    "updated_at": "2026-08-03T21:27:48.108Z",
    "access": "domain",
    "acl": [
      {
        "principal": "@dionisio",
        "role": "owner"
      }
    ]
  },
  "pilares": [
    {
      "id": "p1",
      "nombre": "Diversidad de Productos y Excelencia",
      "desc": "Aumentar presencia y adopción de marca liderando categorías con buena performance digital.",
      "okrIds": [
        "o2"
      ]
    },
    {
      "id": "p2",
      "nombre": "Integración Vertical",
      "desc": "Priorizar la integración de procesos que agregan valor en la cadena de negocio.",
      "okrIds": []
    },
    {
      "id": "p3",
      "nombre": "Rentabilidad",
      "desc": "Empresa sana y sustentable, mentalidad de dueño en cada decisión.",
      "okrIds": [
        "o3"
      ]
    },
    {
      "id": "p4",
      "nombre": "Mística Bidcom",
      "desc": "Vivir los valores, apertura, cultura de transformación y superación.",
      "okrIds": []
    },
    {
      "id": "p5",
      "nombre": "Experiencia de Cliente",
      "desc": "Priorizar la expectativa del cliente en todo proceso que lo impacte.",
      "okrIds": [
        "o4"
      ]
    },
    {
      "id": "p6",
      "nombre": "Excelencia Operacional",
      "desc": "Máxima eficiencia, automatización y escalabilidad en procesos.",
      "okrIds": []
    },
    {
      "id": "p7",
      "nombre": "Alianza Estratégica con MeLi",
      "desc": "Acompañar a MeLi en iniciativas que apalanquen el crecimiento de Bidcom.",
      "okrIds": [
        "o1"
      ]
    },
    {
      "id": "p8",
      "nombre": "Regionalización",
      "desc": "Elevar el valor de marca diversificando presencia en otros países.",
      "okrIds": []
    },
    {
      "id": "zz_f4_pilar",
      "nombre": "F4 test pilar",
      "desc": "temporal",
      "okrIds": [
        "zz_f4_obj"
      ]
    }
  ],
  "negocios": [
    {
      "id": "ecommerce-ar",
      "nombre": "Ecommerce Argentina"
    },
    {
      "id": "agro",
      "nombre": "Bidcom Agro"
    }
  ],
  "plataformas": [
    {
      "id": "tecnologia",
      "nombre": "Tecnología",
      "area": "Tecnologia"
    },
    {
      "id": "finanzas",
      "nombre": "Finanzas",
      "area": "Finanzas"
    },
    {
      "id": "px",
      "nombre": "PX",
      "area": "PX"
    },
    {
      "id": "marketing",
      "nombre": "Marketing",
      "area": "Marketing"
    }
  ],
  "objetivos": [
    {
      "id": "o1",
      "negocioId": "ecommerce-ar",
      "nombre": "Liderazgo e-commerce",
      "texto": "Consolidar el liderazgo de Bidcom en el comercio electrónico argentino y mantener el posicionamiento de ser la empresa modelo de MercadoLibre Global."
    },
    {
      "id": "o2",
      "negocioId": "ecommerce-ar",
      "nombre": "Gadnic",
      "texto": "Consolidar a Gadnic como la marca nativa digital referente en Argentina, transformando tendencias globales en productos funcionales y accesibles."
    },
    {
      "id": "o3",
      "negocioId": "ecommerce-ar",
      "nombre": "Utilidad y eficiencia",
      "texto": "Alcanzar una utilidad Neta de 32 Mio USD al cierre del ejercicio asegurando eficiencia operativa."
    },
    {
      "id": "o4",
      "negocioId": "ecommerce-ar",
      "nombre": "Experiencia de cliente",
      "texto": "Ofrecer una experiencia de cliente extraordinaria, consistente y confiable en todos los canales de venta de Bidcom."
    },
    {
      "id": "o5px",
      "negocioId": "px",
      "nombre": "Equipo de alto rendimiento",
      "texto": "Consolidar un equipo de alto rendimiento, con las personas adecuadas en los roles correctos, que ejecuten con excelencia."
    },
    {
      "id": "oagro1",
      "negocioId": "agro",
      "nombre": "Negocio rentable y escalable",
      "texto": "Construir un negocio agro rentable y escalable."
    },
    {
      "id": "oagro2",
      "negocioId": "agro",
      "nombre": "Integración al ecosistema Bidcom",
      "texto": "Integrar BidcomAgro al ecosistema Bidcom de manera ágil y sin fricciones."
    },
    {
      "id": "oagro3",
      "negocioId": "agro",
      "nombre": "Marca Brumby",
      "texto": "Transformar a Brumby en una marca referente del agro argentino."
    },
    {
      "id": "oagro4",
      "negocioId": "agro",
      "nombre": "Compañía referente del agro",
      "texto": "Consolidar a BidcomAgro como una compañía referente del agro argentino."
    },
    {
      "id": "oagro5",
      "negocioId": "agro",
      "nombre": "Experiencia de cliente Agro",
      "texto": "Ofrecer una experiencia de cliente agro extraordinaria, cercana y confiable."
    },
    {
      "id": "ofin1",
      "negocioId": "finanzas",
      "nombre": "Rentabilidad y valor del Grupo",
      "texto": "Maximizar rentabilidad operativa y creación de valor del Grupo (E-tailer + Agro + Regional)."
    },
    {
      "id": "ofin2",
      "negocioId": "finanzas",
      "nombre": "Resultados financieros y liquidez",
      "texto": "Maximizar los resultados financieros del Grupo y sus accionistas, asegurando liquidez y eficiencia del capital de trabajo."
    },
    {
      "id": "ofin3",
      "negocioId": "finanzas",
      "nombre": "Excelencia operacional de Finanzas",
      "texto": "Elevar la excelencia operacional de Finanzas."
    },
    {
      "id": "ofin4",
      "negocioId": "finanzas",
      "nombre": "Reporting y control de performance",
      "texto": "Fortalecer el rol de Finanzas en reporting y como controller de performance de los negocios."
    },
    {
      "id": "otec1",
      "negocioId": "tecnologia",
      "nombre": "Organización Data-Driven",
      "texto": "Consolidar una organización Data-Driven mediante un ecosistema de datos confiable, gobernado y escalable para todas las unidades de negocio."
    },
    {
      "id": "otec2",
      "negocioId": "tecnologia",
      "nombre": "Excelencia Operacional y Agilidad",
      "texto": "Impulsar la Excelencia Operacional y la Agilidad mediante la evolución del ecosistema de productos tecnológicos."
    },
    {
      "id": "otec3",
      "negocioId": "tecnologia",
      "nombre": "Performance y conversión E-commerce",
      "texto": "Maximizar el performance y la conversión de las plataformas E-commerce Web propias para potenciar el crecimiento."
    },
    {
      "id": "otec4",
      "negocioId": "tecnologia",
      "nombre": "Talento de los Squads",
      "texto": "Fortalecer la capacidad de ejecución y la estructura de talento de los Squads de Tecnología."
    },
    {
      "id": "otec5",
      "negocioId": "tecnologia",
      "nombre": "Operación tecnológica segura y eficiente",
      "texto": "Construir una operación tecnológica segura y eficiente que potencie el crecimiento sostenible de Bidcom."
    },
    {
      "id": "omkt1",
      "negocioId": "marketing",
      "nombre": "Crecimiento y eficiencia Ecommerce",
      "texto": "Crecimiento +85% YoY GMV, con 10% net profit y eficiencia de P&L."
    },
    {
      "id": "omkt2",
      "negocioId": "marketing",
      "nombre": "Crecimiento y eficiencia Marketplaces",
      "texto": "Crecimiento +57% YoY GMV, con 10% net profit y eficiencia de P&L."
    },
    {
      "id": "omkt3",
      "negocioId": "marketing",
      "nombre": "Eficiencia de inversión publicitaria",
      "texto": "Mejorar la eficiencia de la inversión publicitaria para contribuir al EBITDA objetivo del 10%, habilitando crecimiento del +67% en revenue total de la compañía."
    },
    {
      "id": "omkt4",
      "negocioId": "marketing",
      "nombre": "Conversión web y lifecycle marketing",
      "texto": "Aumentar la conversión web +14pp YoY y la frecuencia de compra a 2, apalancando estrategias de personalización y lifecycle marketing con Salesforce."
    },
    {
      "id": "omkt5",
      "negocioId": "marketing",
      "nombre": "Rebranding de Gadnic",
      "texto": "Rebranding de Gadnic con definición de buyer persona y objetivo de aumentar a 15% el Top of Mind y el tráfico directo +10pp."
    },
    {
      "id": "omkt6",
      "negocioId": "marketing",
      "nombre": "Social Commerce",
      "texto": "Impulsar el canal de Social Commerce con aporte del 10% de la facturación web de Gadnic."
    },
    {
      "id": "zz_f4_obj",
      "negocioId": "ecommerce-ar",
      "nombre": "F4 test obj",
      "texto": "..."
    }
  ],
  "krs": [
    {
      "id": "k1",
      "objId": "o1",
      "desc": "Alcanzar una facturación anual con un 10% de Utilidad GNI",
      "sentido": "mayor",
      "unidad": "%",
      "target": 10,
      "value": {
        "mode": "literal",
        "actual": 7.66,
        "prev": 7.8
      },
      "boards": [
        "comite"
      ]
    },
    {
      "id": "k2",
      "objId": "o1",
      "desc": "TGMV del sitio web propio (Bidcom + Gadnic) sobre el TGMV total",
      "sentido": "mayor",
      "unidad": "%",
      "target": 25,
      "value": {
        "mode": "literal",
        "actual": 17.09,
        "prev": 17.22
      },
      "boards": [
        "comite"
      ]
    },
    {
      "id": "k3",
      "objId": "o1",
      "desc": "TGMV marcas de terceros sobre el TGMV total",
      "sentido": "mayor",
      "unidad": "%",
      "target": null,
      "value": {
        "mode": "literal",
        "actual": 17.74,
        "prev": 17.24
      },
      "boards": [
        "comite"
      ]
    },
    {
      "id": "k4",
      "objId": "o1",
      "desc": "Mantener el liderazgo en MercadoLibre Argentina en TGMV",
      "sentido": "mayor",
      "unidad": "M USD",
      "target": null,
      "value": {
        "mode": "literal",
        "actual": 91.9
      },
      "boards": [
        "comite"
      ]
    },
    {
      "id": "k5",
      "objId": "o1",
      "desc": "Incrementar la participación de FULL sobre el TGMV de MercadoLibre",
      "sentido": "mayor",
      "unidad": "%",
      "target": 35,
      "value": {